,Datetime,headline,source,description,link
0,2025-05-28 16:00:00,Nvidia earnings: What to watch for on Blackwell,Yahoo Finance Video,"Nvidia (NVDA) releases its first quarter results after the market close on Wednesday. One of the big things investors will be watching for is what company leadership says about its Blackwell lineup. Roundhill Investments CEO Dave Mazza shares what he will be looking for in the video above. To watch more expert insights and analysis on the latest market action, check out more Market Domination Overtime here.",https://finance.yahoo.com/video/nvidia-earnings-watch-blackwell-080023480.html
1,2025-05-28 06:25:00,Nvidia earnings live: Nvidia set to report crucial first quarter earnings Wednesday,Yahoo Finance,"Nvidia's first quarter earnings report is scheduled for release after the close on Wednesday, May 28.",https://finance.yahoo.com/news/live/nvidia-earnings-live-nvidia-set-to-report-crucial-first-quarter-earnings-wednesday-121713732.html
2,2025-05-28 04:05:00,"Stock market today: Dow, S&P 500, Nasdaq soar as Trump pauses EU tariff hikes for fast-tracked talks",Yahoo Finance,Optimism for a US-EU trade deal is growing as talks speed up after Trump's delay to 50% tariffs.,https://finance.yahoo.com/news/live/stock-market-today-dow-sp-500-nasdaq-soar-as-trump-pauses-eu-tariff-hikes-for-fast-tracked-talks-133348369.html
3,2025-05-28 03:00:00,Nvidia stock: What export controls mean for the chip giant,Yahoo Finance Video,"Nvidia (NVDA) reports its first quarter results after the market close on Wednesday, May 28. Yahoo Finance Anchor Julie Hyman breaks down what China trade restrictions mean for the chip giant.  To watch more expert insights and analysis on the latest market action, check out more Catalysts here.",https://finance.yahoo.com/video/nvidia-stock-export-controls-mean-180000127.html
4,2025-05-27 19:26:00,Why this Nvidia bull is 'anxious' ahead of earnings,Yahoo Finance Video,"Chipmakers are in focus ahead of Nvidia's (NVDA) earnings report, set to be released on Wednesday. KeyBanc Capital Markets equity research analyst John Vinh and Harvest Portfolio Management chief investment officer Paul Meeks join Morning Brief to examine the chipmaker space and discuss what to expect from Nvidia earnings. To watch more expert insights and analysis on the latest market action, check out more Morning Brief here.",https://finance.yahoo.com/video/why-nvidia-bull-anxious-ahead-135647600.html
5,2025-05-27 19:05:00,Nvidia's bear case: Is the hype train running out of tracks?,Yahoo Finance,"There is a bear case to every bull case on a stock, even Nvidia.",https://finance.yahoo.com/news/nvidias-bear-case-is-the-hype-train-running-out-of-tracks-110530397.html
6,2025-05-28 16:35:00,Nvidia's Big Moment Is Just Ahead. Here's What to Watch For.,Motley Fool,"Nvidia stock drove market gains over the past two years, but the shares stumbled in recent weeks.  Investors have worried about artificial intelligence spending and the general economic backdrop, considering potential import tariffs.  In its earnings report, Nvidia may offer compelling clues about what’s ahead.",https://finance.yahoo.com/news/nvidias-big-moment-just-ahead-083500560.html
7,2025-05-28 16:30:00,1 Dark Horse Candidate for Best-Performing AI Stock Over the Next Five Years,Motley Fool,"Nvidia has been a huge winner in the AI arms race.  Broadcom trades at a high valuation, but that may be deserved.  Nvidia makes graphics processing units (GPUs) that are widely used to train AI models, but there could be a shift occurring.",https://finance.yahoo.com/news/1-dark-horse-candidate-best-083000630.html
8,2025-05-28 16:29:00,Global Markets Mixed; Investors Eye Nvidia Earnings,The Wall Street Journal,"U.S. stock futures pointed to a slightly weaker open, while markets in Asia and Europe were mixed ahead of Nvidia’s earnings later Wednesday.",https://finance.yahoo.com/m/4c5cc58a-c7f2-3d2a-ae3f-70c7377b6fb0/global-markets-mixed-.html
9,2025-05-28 16:22:00,What’s Fueling Wall Street’s 90-Day Optimism on Amphenol (APH)?,Insider Monkey,"We recently published a list of 10 AI Stocks on Analyst’s Radar Today. In this article, we are going to take a look at where Amphenol (NYSE:APH) stands against other AI stocks that are on analyst’s radar today. On May 27, Citi raised the firm’s price target on Amphenol (APH) to $100 from $85 and […]",https://finance.yahoo.com/news/fueling-wall-street-90-day-082206952.html
10,2025-05-28 13:49:00,NVIDIA (NVDA) Gets Buy Rating Despite China Chip Ban – Here’s Why Analysts Are Still Bullish,Insider Monkey,"We recently published a list of 10 AI Stocks on Analyst’s Radar Today. In this article, we are going to take a look at where NVIDIA Corporation (NASDAQ:NVDA) stands against other AI stocks that are on analyst’s radar today. NVIDIA Corporation (NASDAQ:NVDA) specializes in AI-driven solutions, offering platforms for data centers, self-driving cars, robotics, and […]",https://finance.yahoo.com/news/nvidia-nvda-gets-buy-rating-081939344.html
11,2025-05-28 16:05:00,4 Vanguard ETFs to Buy With $500 and Hold Forever,Motley Fool,"The Vanguard S&P 500 ETF is a core holding that has performed well over the years.  The Vanguard Mega Cap Growth ETF and the Vanguard Information Technology ETF are two great options.  For investors looking for a slightly safer ETF with less tech exposure, the Vanguard Dividend Appreciation ETF is a top pick.",https://finance.yahoo.com/news/4-vanguard-etfs-buy-500-080500616.html
12,2025-05-28 15:51:00,This Operating Metric Is Going to Make or Break Nvidia Stock on May 28,Motley Fool,"If you're just waiting for Nvidia's sales and earnings per share figures, you'll be missing out on the big picture.",https://finance.yahoo.com/news/operating-metric-going-break-nvidia-075100417.html
13,2025-05-28 15:37:00,Stock Rally Stalls with Nvidia Results Watched as Next Catalyst,Barrons.com,"U.S. stocks were headed for slight losses early on Wednesday after strong gains the previous day over easing trade tensions with the European Union.  Earnings from chip maker Nvidia after the market close are set to take the spotlight.  Dow Jones Industrial Average futures were down 42 points, or 0.1%.",https://finance.yahoo.com/m/356f6d48-e1a3-3ac5-be20-09c9a01d2c73/stock-rally-stalls-with.html
14,2025-05-28 15:20:00,Nvidia's Outlook Could Disappoint. It's Likely to Be a Temporary Blip.,Barrons.com,"For the first time since Nvidia started its AI super cycle two years ago, the chip maker may guide materially lower than the Wall Street consensus.  As has been the case since ChatGPT launched an AI revolution, the long-term story around AI remains strong.  Here are the numbers for Wednesday’s earnings: Analysts expect Nvidia to report April quarter revenue of $43.3 billion, up 66% versus the prior year, with adjusted earnings per share of 73 cents.",https://finance.yahoo.com/m/f52d6157-8fa4-3374-99a7-3714b4c71b07/nvidia-s-outlook-could.html
15,2025-05-28 16:05:00,"The Stock Market Could Make Big Moves This Week Following Critical News on Nvidia, Interest Rates, and Inflation",Motley Fool,"The Federal Reserve will publish the minutes from its May meeting on Wednesday, May 28.  The Commerce Department will release April PCE inflation and consumer spending data on Friday, May 30.  The S&P 500 (SNPINDEX: ^GSPC) has rebounded 18% since hitting bottom in early April after President Trump announced his ""Liberation Day"" tariffs.",https://finance.yahoo.com/news/stock-market-could-big-moves-070500144.html
16,2025-05-28 12:30:00,"NVDA Stock Is Priced for Perfection, Investment Bank Analyst Suggests",Insider Monkey,"NVIDIA Corporation (NASDAQ:NVDA)’s “current stock price balances the bull case and the bear case,” Gil Luria, a stock analyst at investment bank DA Davidson, recently stated on CNBC. Nvidia (NASDAQ:NVDA) could be hurt by an erosion of its revenue from both China and the large cloud-infrastructure players, according to Luria, who has a Hold rating […]",https://finance.yahoo.com/news/nvda-stock-priced-perfection-investment-070050105.html
17,2025-05-28 12:13:00,Motley Fool Co-Founder David Gardner: What Rule Breakers Value,Motley Fool,"If you want to own best-in-class companies, you need to own stocks with a high sticker price.",https://finance.yahoo.com/news/motley-fool-co-founder-david-064300813.html
18,2025-05-28 14:35:00,"Bitcoin Uptrend at Risk Ahead of Nvidia Earnings, Fed Minutes; XRP Holds Key Support Amid XRPFi Narrative",CoinDesk,The Federal Reserve's minutes and Nvidia's earnings are key events that could influence market movements.,https://finance.yahoo.com/news/bitcoin-uptrend-risk-ahead-nvidia-053559612.html
19,2025-05-28 12:32:00,Morning Bid: Nvidia earnings take the spotlight,Reuters,"Earnings results from Nvidia will be the marquee event for markets on Wednesday, with all eyes on how much U.S. technology curbs on China will cost the AI bellwether.  As it is, traders in the options markets are bracing for industry-wide volatility after the results, with defensive options contracts on a major semiconductor ETF drawing heavy attention.  Earnings aside, investors will also be watching developments in global bond markets after demand on Wednesday for Japan's 40-year government bond auction was its lowest since November, underscoring the market's diminishing capacity to absorb new debt.",https://finance.yahoo.com/news/morning-bid-nvidia-earnings-spotlight-043228066.html
